Brand, Type, Price, Original Price, Discount 
Robbie jones, Sneakers For Men, ₹499, ₹999, 50% off 
BRUTON, Combo Pack Of 5 Casual Shoes Canvas Shoes For Men, ₹759, ₹3999, 81% off 
aadi, Running Shoes For Men, ₹318, ₹999, 68% off 
ASIAN, Cosko Sports Shoes Running Shoes Walking Shoes Training..., ₹687, ₹999, 31% off 
aadi, Running Shoes For Men, ₹379, ₹999, 62% off 
ASIAN, WNDR-13 Running Shoes For Men, ₹521, ₹599, 13% off 
BEEROCK, Oxygen Running Shoes For Men, ₹471, ₹999, 52% off 
REEBOK, Edge Identity Running Shoes For Men, ₹1559, ₹2599, 40% off 
aadi, Walking Shoes For Men, ₹449, ₹1999, 77% off 
PORT, Running Shoes For Men, ₹318, ₹999, 68% off 
aadi, Sneakers For Men, ₹298, ₹999, 70% off 
aadi, Casuals For Men, ₹474, ₹999, 52% off 
Shoes Bank, White Sneaker For Men's/Boy's Sneakers For Men, ₹331, ₹999, 66% off 
BRUTON, Combo Pack Of 4 Canvas Sneakers For Men, ₹499, ₹3499, 85% off 
T-ROCK, Loafers For Men, ₹449, ₹999, 55% off 
ESSENCE, Casuals For Men, ₹468, ₹999, 53% off 
ASIAN, Elasto-02 Grey Black Running Shoes For Women, ₹774, ₹1499, 48% off 
Layasa, sports shoes for men | Latest Stylish Casual sneakers f..., ₹374, ₹999, 62% off 
BEEROCK, Oxygen Running Shoes For Men, ₹471, ₹999, 52% off 
REEBOK, Reebok Pride TR Training & Gym Shoes For Men, ₹2025, ₹3599, 43% off 
K ' Footlance, Sports shoes Running partywear gym shoes Running Shoes ..., ₹448, ₹999, 55% off 
aadi, Walking Shoes For Men, ₹426, ₹999, 57% off 
BEEROCK, Oxygen Running Shoes For Men, ₹471, ₹999, 52% off 
aadi, Mesh Sports Walking Shoes For Men, ₹299, ₹999, 70% off 
ASIAN, Bouncer-01 Running shoes for boys | sports shoes for me..., ₹719, ₹999, 28% off 
MILESWALKER, Running Shoes For Men, ₹318, ₹999, 68% off 
ASIAN, Cosko Sports Shoes Running Shoes Walking Shoes Training..., ₹687, ₹999, 31% off 
aadi, Boots For Men, ₹474, ₹999, 52% off 
SPARX, SD0323G Canvas Shoes For Men, ₹630, ₹749, 15% off 
asics, GEL-VENTURE 8 Running Shoes For Men, ₹2999, ₹4999, 40% off 
believe, high top Sneakers for men High Tops For Men, ₹446, ₹999, 55% off 
bluemaker, casual for men (blue 06) Sneakers For Men, ₹474, ₹999, 52% off 
Robbie jones, Casual Sneakers Shoes For Men Sneakers For Men, ₹399, ₹999, 60% off 
ESSENCE, Smart Sneakers For Men, ₹449, ₹999, 55% off 
MILESWALKER, Stylish Casual Sports Shoe Sneakers For Women Sneakers ..., ₹479, ₹999, 52% off 
GS, Running Shoes Walking Shoes For Men, ₹298, ₹999, 70% off 
BRUTON, Men Sports Running Shoes For Men, ₹299, ₹1299, 76% off 
SUSON, Black Gym/Walking/Running Sports Sneakers For Men, ₹318, ₹999, 68% off 
Density, SOCKS Running Shoes For Men, ₹499, ₹999, 50% off 
BEEROCK, Kosko Running Shoes For Men, ₹539, ₹999, 46% off 
